{
  "schema": "kinetic/gym/execution-telemetry@0.1",
  "case_id": "case-ee9eaf0dc9",
  "stages": {
    "planning": {
      "started_at": "2026-09-01T06:17:15.194Z",
      "ended_at": "2026-09-01T06:25:57.594Z",
      "duration_ms": 522400,
      "status": "COMPLETED",
      "attempt": 1,
      "receipt_refs": [
        "runs/case-ee9eaf0dc9/planning/v2/variant-brief.json",
        "runs/case-ee9eaf0dc9/reports/fidelity-v0.json"
      ]
    },
    "retrieval": {
      "started_at": "2026-09-01T06:25:57.594Z",
      "ended_at": "2026-09-01T06:26:45.189Z",
      "duration_ms": 47595,
      "status": "COMPLETED",
      "attempt": 1,
      "receipt_refs": [
        "runs/case-ee9eaf0dc9/planning/v2/variant-brief.json",
        "runs/case-ee9eaf0dc9/planning/v2/retrieval-receipt.json",
        "runs/case-ee9eaf0dc9/reports/fidelity-v0.json"
      ]
    },
    "prebuild_review": {
      "started_at": "2026-09-01T06:26:45.189Z",
      "ended_at": "2026-09-01T06:28:21.588Z",
      "duration_ms": 96399,
      "status": "COMPLETED",
      "attempt": 1,
      "receipt_refs": [
        "runs/case-ee9eaf0dc9/planning/v2/variant-brief.json",
        "runs/case-ee9eaf0dc9/planning/v2/retrieval-receipt.json",
        "runs/case-ee9eaf0dc9/planning/v2/prebuild-review.json",
        "runs/case-ee9eaf0dc9/reports/fidelity-v0.json"
      ]
    },
    "build": {
      "started_at": "2026-09-01T06:38:23.898Z",
      "ended_at": "2026-09-01T06:38:24.399Z",
      "duration_ms": 501,
      "status": "COMPLETED",
      "attempt": 1,
      "receipt_refs": [
        "runs/case-ee9eaf0dc9/planning/v2/variant-brief.json",
        "runs/case-ee9eaf0dc9/planning/v2/retrieval-receipt.json",
        "runs/case-ee9eaf0dc9/planning/v2/prebuild-review.json",
        "runs/case-ee9eaf0dc9/variants/v2",
        "runs/case-ee9eaf0dc9/reports/fidelity-v0.json"
      ]
    },
    "capture": {
      "started_at": "2026-09-01T06:40:07.299Z",
      "ended_at": "2026-09-01T06:41:28.895Z",
      "duration_ms": 81596,
      "status": "COMPLETED",
      "attempt": 1,
      "receipt_refs": [
        "runs/case-ee9eaf0dc9/planning/v2/variant-brief.json",
        "runs/case-ee9eaf0dc9/planning/v2/retrieval-receipt.json",
        "runs/case-ee9eaf0dc9/planning/v2/prebuild-review.json",
        "runs/case-ee9eaf0dc9/variants/v2",
        "runs/case-ee9eaf0dc9/reports/technical-evaluation-v2.json",
        "runs/case-ee9eaf0dc9/captures/v2/manifest.json",
        "runs/case-ee9eaf0dc9/reports/fidelity-v0.json"
      ]
    },
    "technical_evaluation": {
      "started_at": "2026-09-01T06:38:24.399Z",
      "ended_at": "2026-09-01T06:40:07.299Z",
      "duration_ms": 102900,
      "status": "COMPLETED",
      "attempt": 1,
      "receipt_refs": [
        "runs/case-ee9eaf0dc9/planning/v2/variant-brief.json",
        "runs/case-ee9eaf0dc9/planning/v2/retrieval-receipt.json",
        "runs/case-ee9eaf0dc9/planning/v2/prebuild-review.json",
        "runs/case-ee9eaf0dc9/variants/v2",
        "runs/case-ee9eaf0dc9/reports/technical-evaluation-v2.json",
        "runs/case-ee9eaf0dc9/reports/fidelity-v0.json"
      ]
    },
    "design_evaluation": {
      "started_at": "2026-09-01T06:41:28.895Z",
      "ended_at": "2026-09-01T06:42:34.392Z",
      "duration_ms": 65497,
      "status": "COMPLETED",
      "attempt": 1,
      "receipt_refs": [
        "runs/case-ee9eaf0dc9/planning/v2/variant-brief.json",
        "runs/case-ee9eaf0dc9/planning/v2/retrieval-receipt.json",
        "runs/case-ee9eaf0dc9/planning/v2/prebuild-review.json",
        "runs/case-ee9eaf0dc9/variants/v2",
        "runs/case-ee9eaf0dc9/reports/technical-evaluation-v2.json",
        "runs/case-ee9eaf0dc9/captures/v2/manifest.json",
        "runs/case-ee9eaf0dc9/reports/design-evaluation-v2.json",
        "runs/case-ee9eaf0dc9/reports/fidelity-v0.json"
      ]
    },
    "repair": null,
    "review_package_generation": {
      "started_at": "2026-09-01T06:42:34.392Z",
      "ended_at": "2026-09-01T06:52:04.798Z",
      "duration_ms": 570406,
      "status": "COMPLETED",
      "attempt": 1,
      "receipt_refs": [
        "runs/case-ee9eaf0dc9/planning/v2/variant-brief.json",
        "runs/case-ee9eaf0dc9/planning/v2/retrieval-receipt.json",
        "runs/case-ee9eaf0dc9/planning/v2/prebuild-review.json",
        "runs/case-ee9eaf0dc9/variants/v2",
        "runs/case-ee9eaf0dc9/reports/technical-evaluation-v2.json",
        "runs/case-ee9eaf0dc9/captures/v2/manifest.json",
        "runs/case-ee9eaf0dc9/reports/design-evaluation-v2.json",
        "runs/case-ee9eaf0dc9/reports/fidelity-v0.json"
      ]
    },
    "human_review_waiting": null
  },
  "metrics": {
    "model": null,
    "provider": null,
    "model_calls": null,
    "tokens_input": null,
    "tokens_output": null,
    "tool_calls": null,
    "vision_calls": null,
    "repair_attempts": 0,
    "build_attempts": 1,
    "asset_preparation_ms": null,
    "monetary_cost": null,
    "monetary_cost_status": "UNKNOWN",
    "availability_notes": [
      "model, provider, token, tool, vision, asset preparation, and cost metrics were not exposed"
    ]
  },
  "updated_at": "2026-09-01T06:52:04.798Z"
}
